{
  "acceptance_contract_sha256": "b46620e26cec19872279f0a0ac9aefbc562436c808b1ebea8a078b58e2c8585a",
  "artifacts": [
    {
      "artifact_id": "art-po03-wa-025-hypotheses",
      "bytes": 2433,
      "content_uri": "git:cursor/po03-wa-025-b195-a01-1a9f@ee51ff50bdd31d6abc8f530a6faa0b1a33289988:workstreams/po03/wave-a/units/wa-025/result/hypotheses.json",
      "logical_name": "result/hypotheses.json",
      "media_type": "application/json",
      "readback_verified_at": "2026-08-22T07:37:34Z",
      "sha256": "426b888f00bc604102fbd33b8bc95104f401a3f27c247e9ff20ed0293c9002ca"
    },
    {
      "artifact_id": "art-po03-wa-025-readback-verifier",
      "bytes": 10116,
      "content_uri": "git:cursor/po03-wa-025-b195-a01-1a9f@ee51ff50bdd31d6abc8f530a6faa0b1a33289988:workstreams/po03/wave-a/units/wa-025/result/immutable_readback.py",
      "logical_name": "result/immutable_readback.py",
      "media_type": "text/x-python; charset=utf-8",
      "readback_verified_at": "2026-08-22T07:37:34Z",
      "sha256": "7286a79d6ed5ce341b2a05652ffb0f704053333abbb303c79dcc2a50cb153ac1"
    },
    {
      "artifact_id": "art-po03-wa-025-limitations",
      "bytes": 2816,
      "content_uri": "git:cursor/po03-wa-025-b195-a01-1a9f@ee51ff50bdd31d6abc8f530a6faa0b1a33289988:workstreams/po03/wave-a/units/wa-025/result/limitations.json",
      "logical_name": "result/limitations.json",
      "media_type": "application/json",
      "readback_verified_at": "2026-08-22T07:37:34Z",
      "sha256": "71e95f31de0a897059611715930de8e9ee7aad7af6272d9e8a0bbae09f113c36"
    },
    {
      "artifact_id": "art-po03-wa-025-mechanism-change",
      "bytes": 2182,
      "content_uri": "git:cursor/po03-wa-025-b195-a01-1a9f@ee51ff50bdd31d6abc8f530a6faa0b1a33289988:workstreams/po03/wave-a/units/wa-025/result/mechanism-change.json",
      "logical_name": "result/mechanism-change.json",
      "media_type": "application/json",
      "readback_verified_at": "2026-08-22T07:37:34Z",
      "sha256": "dd4dee7142710b902a07d7f3e1285fdc25379f5fd233223ca0486816d93f7291"
    },
    {
      "artifact_id": "art-po03-wa-025-reproduction-executable",
      "bytes": 9508,
      "content_uri": "git:cursor/po03-wa-025-b195-a01-1a9f@ee51ff50bdd31d6abc8f530a6faa0b1a33289988:workstreams/po03/wave-a/units/wa-025/result/reproduce_branch_movement.py",
      "logical_name": "result/reproduce_branch_movement.py",
      "media_type": "text/x-python; charset=utf-8",
      "readback_verified_at": "2026-08-22T07:37:34Z",
      "sha256": "28c9fb0c724e1c7f20820a48b1f5c6770917d161ee535c6a3c4d8adc6eb6e9ab"
    },
    {
      "artifact_id": "art-po03-wa-025-reproduction-result",
      "bytes": 4418,
      "content_uri": "git:cursor/po03-wa-025-b195-a01-1a9f@ee51ff50bdd31d6abc8f530a6faa0b1a33289988:workstreams/po03/wave-a/units/wa-025/result/reproduction-result.json",
      "logical_name": "result/reproduction-result.json",
      "media_type": "application/json",
      "readback_verified_at": "2026-08-22T07:37:34Z",
      "sha256": "2273495fef44533d4198133b55deb239e09663da130bb0acf56263e6cdd4948a"
    },
    {
      "artifact_id": "art-po03-wa-025-result",
      "bytes": 4704,
      "content_uri": "git:cursor/po03-wa-025-b195-a01-1a9f@ee51ff50bdd31d6abc8f530a6faa0b1a33289988:workstreams/po03/wave-a/units/wa-025/result/result.json",
      "logical_name": "result/result.json",
      "media_type": "application/json",
      "readback_verified_at": "2026-08-22T07:37:34Z",
      "sha256": "2c722ab9d9825096942abd6ab65b1e0dcd257eabd58c2eed44109d11a0866f9c"
    },
    {
      "artifact_id": "art-po03-wa-025-source-claims",
      "bytes": 7565,
      "content_uri": "git:cursor/po03-wa-025-b195-a01-1a9f@ee51ff50bdd31d6abc8f530a6faa0b1a33289988:workstreams/po03/wave-a/units/wa-025/result/source-claims.json",
      "logical_name": "result/source-claims.json",
      "media_type": "application/json",
      "readback_verified_at": "2026-08-22T07:37:34Z",
      "sha256": "103ec87b58f12e0b261190c031fe96ce4da1f063024fee62a8d337732ae440e1"
    },
    {
      "artifact_id": "art-po03-wa-025-strategy-proposals",
      "bytes": 780,
      "content_uri": "git:cursor/po03-wa-025-b195-a01-1a9f@ee51ff50bdd31d6abc8f530a6faa0b1a33289988:workstreams/po03/wave-a/units/wa-025/result/strategy-proposals.json",
      "logical_name": "result/strategy-proposals.json",
      "media_type": "application/json",
      "readback_verified_at": "2026-08-22T07:37:34Z",
      "sha256": "bacad7c8cff726b459f4eae24f07508809f6e53701e67b4d21780704f1fb15b4"
    },
    {
      "artifact_id": "art-po03-wa-025-test-output",
      "bytes": 2362,
      "content_uri": "git:cursor/po03-wa-025-b195-a01-1a9f@ee51ff50bdd31d6abc8f530a6faa0b1a33289988:workstreams/po03/wave-a/units/wa-025/result/test-output.txt",
      "logical_name": "result/test-output.txt",
      "media_type": "text/plain; charset=utf-8",
      "readback_verified_at": "2026-08-22T07:37:34Z",
      "sha256": "709d1208d2f2246c690cef15a98bcdf9694d0fee6a6dc3ba2cbc1b02812a4512"
    },
    {
      "artifact_id": "art-po03-wa-025-focused-tests",
      "bytes": 7142,
      "content_uri": "git:cursor/po03-wa-025-b195-a01-1a9f@ee51ff50bdd31d6abc8f530a6faa0b1a33289988:workstreams/po03/wave-a/units/wa-025/result/test_immutable_readback.py",
      "logical_name": "result/test_immutable_readback.py",
      "media_type": "text/x-python; charset=utf-8",
      "readback_verified_at": "2026-08-22T07:37:34Z",
      "sha256": "f9d5bab776fd65d0274e49ec56dc7888b6474801b5e0fed98336d502735f24c6"
    },
    {
      "artifact_id": "art-po03-wa-025-tests",
      "bytes": 3361,
      "content_uri": "git:cursor/po03-wa-025-b195-a01-1a9f@ee51ff50bdd31d6abc8f530a6faa0b1a33289988:workstreams/po03/wave-a/units/wa-025/result/tests.json",
      "logical_name": "result/tests.json",
      "media_type": "application/json",
      "readback_verified_at": "2026-08-22T07:37:34Z",
      "sha256": "e2c2b42b522ec29adec8e509928748a137ff0390f6420e0213ce281f4c71c36a"
    },
    {
      "artifact_id": "PO03-WA-025-ARTIFACT-MANIFEST",
      "bytes": 7508,
      "content_uri": "git:cursor/po03-wa-025-b195-a01-1a9f@ee51ff50bdd31d6abc8f530a6faa0b1a33289988:workstreams/po03/wave-a/units/wa-025/result/artifact-manifest.json",
      "logical_name": "result/artifact-manifest.json",
      "media_type": "application/json",
      "readback_verified_at": "2026-08-22T07:37:34Z",
      "sha256": "3cfb0c5765df1eb5b4a6b3150847240789336df5c4e95a07808a0ffca10d35f2"
    },
    {
      "artifact_id": "PO03-WA-025-READY-TO-COMMIT",
      "bytes": 17967,
      "content_uri": "git:cursor/po03-wa-025-b195-a01-1a9f@ee51ff50bdd31d6abc8f530a6faa0b1a33289988:workstreams/po03/wave-a/units/wa-025/result/ready-to-commit.json",
      "logical_name": "result/ready-to-commit.json",
      "media_type": "application/json",
      "readback_verified_at": "2026-08-22T07:37:34Z",
      "sha256": "0fd9b8e6a53acfef068a1d04dc6df9d1a98996f35e46b7b90425bc7d0279713a"
    }
  ],
  "attempt": {
    "attempt_id": "PO03-WA-025-A01",
    "checkpoint_seq": 4,
    "fence_token": 1,
    "heartbeat_at": "2026-08-22T07:32:19Z",
    "idempotency_key": "po03:100bc20:wa-025:a01",
    "lease_id": "lease-po03-wa-025-a01",
    "provider_run_id": "e49cb15f-d181-44ec-bcdd-1bba61e3fffb",
    "worker_id": "best-of-n-runner-bc-b1956656-wa-025-a01"
  },
  "commission_id": "COM-PO03-REPOSITORY-ENGINEERING-PORTABLE-RUNTIME-20260822-v001",
  "completion_actor": "coordinator",
  "immutable_input_manifest_sha256": "8bc8d7450f5980a14958ead414352f6f7981a36bc048a65d4ffeeeec6648e45a",
  "independent_acceptance": {
    "receipt_uri": "workstreams/po03/control/reviews/wave-a/wa-025.json",
    "reviewer_id": "controller-verifier:bc-b1956656-b897-4889-aeab-82c4556c1a9f",
    "state": "ACCEPTED"
  },
  "obzio_state": "COMPLETED",
  "protocol_version": "OBZIO-TRANSACTIONAL-RESULT-v1",
  "provider_state": "COMPLETED",
  "result_transaction": {
    "artifact_count": 14,
    "committed_at": "2026-08-22T07:33:20+00:00",
    "manifest_sha256": "3cfb0c5765df1eb5b4a6b3150847240789336df5c4e95a07808a0ffca10d35f2",
    "manifest_uri": "git:cursor/po03-wa-025-b195-a01-1a9f@ee51ff50bdd31d6abc8f530a6faa0b1a33289988:workstreams/po03/wave-a/units/wa-025/result/artifact-manifest.json",
    "parent_ingested_at": "2026-08-22T07:37:34Z",
    "result_commit_id": "dde205226268783deee9a9dd8244ef45f3f22da2",
    "result_txn_id": "txn-po03-wa-025-a01",
    "state": "INGESTED",
    "total_bytes": 82862,
    "verified_at": "2026-08-22T07:37:34Z"
  },
  "task_id": "PO03-WA-025"
}
