{
  "acceptance_contract_sha256": "f7a179472f1db2214d9718ca5410df92aa41c5c0c23a3dfeb175b78dfdad1b5d",
  "artifacts": [
    {
      "artifact_id": "a10-u04-art-01",
      "bytes": 11985,
      "content_uri": "git:cursor/po03-a10-crossfamily-review-ed20@cad4140e0f112c053ffe658e5b76272f09451aba:workstreams/po03/review/sonnet/a9-disposition.json",
      "logical_name": "a9-disposition.json",
      "media_type": "application/json",
      "readback_verified_at": "2026-08-22T08:00:11Z",
      "sha256": "f0dd8cfce64203a182620acd89f24f117a7b2f48f1ccdc9cf8efc75857c8c75c"
    },
    {
      "artifact_id": "a10-u04-art-02",
      "bytes": 13158,
      "content_uri": "git:cursor/po03-a10-crossfamily-review-ed20@cad4140e0f112c053ffe658e5b76272f09451aba:workstreams/po03/review/sonnet/defect-profile-comparison-a6.json",
      "logical_name": "defect-profile-comparison-a6.json",
      "media_type": "application/json",
      "readback_verified_at": "2026-08-22T08:00:11Z",
      "sha256": "3c4b1ff49cb391d022fa06a3ab90470690cdfbb54213c737b9143c57b0fb074e"
    },
    {
      "artifact_id": "a10-u04-art-03",
      "bytes": 4081,
      "content_uri": "git:cursor/po03-a10-crossfamily-review-ed20@cad4140e0f112c053ffe658e5b76272f09451aba:workstreams/po03/review/sonnet/overall-disposition.json",
      "logical_name": "overall-disposition.json",
      "media_type": "application/json",
      "readback_verified_at": "2026-08-22T08:00:11Z",
      "sha256": "355d31397087d9f4ab7a556249ffb1592a27af93de3c84f2320bc9a17fa9d706"
    },
    {
      "artifact_id": "a10-u04-art-04",
      "bytes": 15219,
      "content_uri": "git:cursor/po03-a10-crossfamily-review-ed20@cad4140e0f112c053ffe658e5b76272f09451aba:workstreams/po03/tests/test_a10_u04_dispositions.py",
      "logical_name": "test_a10_u04_dispositions.py",
      "media_type": "text/x-python",
      "readback_verified_at": "2026-08-22T08:00:11Z",
      "sha256": "0bce75c1f3c951b886256e00399c4b2c7f4adad40556a7974ea17b7e405e6ffc"
    }
  ],
  "attempt": {
    "attempt_id": "a10-u04-attempt-1",
    "checkpoint_seq": 4,
    "fence_token": 1,
    "heartbeat_at": "2026-08-22T08:00:11Z",
    "idempotency_key": "a10-u04:860cedb3eac78a92",
    "lease_id": "lease-a10-u04-1",
    "provider_run_id": "po03-a10-subagent",
    "worker_id": "po03-worker-a10"
  },
  "commission_id": "COM-PO03-REPOSITORY-ENGINEERING-PORTABLE-RUNTIME-20260822-v001",
  "completion_actor": null,
  "immutable_input_manifest_sha256": "860cedb3eac78a922e773b74c2da10b17d2bef3162021885319ead880c2429b4",
  "independent_acceptance": {
    "receipt_uri": null,
    "reviewer_id": null,
    "state": "NOT_TESTED"
  },
  "obzio_state": "RESULT_COMMITTED",
  "protocol_version": "OBZIO-TRANSACTIONAL-RESULT-v1",
  "provider_state": "COMPLETED",
  "result_transaction": {
    "artifact_count": 4,
    "committed_at": "2026-08-22T08:00:11Z",
    "manifest_sha256": "3b95a9509ec308330c0d675c9804739609f40cbf6bcfcce4e5287bbe15e9810f",
    "manifest_uri": "git:cursor/po03-a10-crossfamily-review-ed20@cad4140e0f112c053ffe658e5b76272f09451aba:a10-u04",
    "parent_ingested_at": null,
    "result_commit_id": "cad4140e0f112c053ffe658e5b76272f09451aba",
    "result_txn_id": "a10-u04-txn-1",
    "state": "COMMITTED",
    "total_bytes": 44443,
    "verified_at": "2026-08-22T08:00:11Z"
  },
  "task_id": "a10-u04"
}
