{"acceptance_contract_sha256":"b43156edd3fb1e61ed6b76d33c5074039a84bf0aedcf817acbcbbddc438c3800","artifacts":[{"artifact_id":"po03-wa-b2e7-035-orphan-route-detector-artifact-001","bytes":4623,"content_uri":"git:28c19b5eb5a385495c83133f93e2e2a3a527b1c0:workstreams/po03/attempts/po03-wa-b2e7-035-orphan-route-detector/__pycache__/orphan_route_detector.cpython-312.pyc","logical_name":"__pycache__/orphan_route_detector.cpython-312.pyc","media_type":"application/x-python-code","readback_verified_at":"2026-08-22T07:15:59Z","sha256":"32219e09d3f56125971b6416b1fb744ded193e45421d84dc09445e24496fc657"},{"artifact_id":"po03-wa-b2e7-035-orphan-route-detector-artifact-002","bytes":2707,"content_uri":"git:28c19b5eb5a385495c83133f93e2e2a3a527b1c0:workstreams/po03/attempts/po03-wa-b2e7-035-orphan-route-detector/orphan_route_detector.py","logical_name":"orphan_route_detector.py","media_type":"text/x-python","readback_verified_at":"2026-08-22T07:15:59Z","sha256":"f8102d290814d0ba42222e9a1482848db9ee59411c7f44559cdc6318a5482e0a"},{"artifact_id":"po03-wa-b2e7-035-orphan-route-detector-artifact-003","bytes":1827,"content_uri":"git:28c19b5eb5a385495c83133f93e2e2a3a527b1c0:workstreams/po03/attempts/po03-wa-b2e7-035-orphan-route-detector/test_orphan_route_detector.py","logical_name":"test_orphan_route_detector.py","media_type":"text/x-python","readback_verified_at":"2026-08-22T07:15:59Z","sha256":"c540bfa3409cf763929e7ae81877cdbc02ea79e950fcbfdc4620312de14bb25c"},{"artifact_id":"po03-wa-b2e7-035-orphan-route-detector-artifact-004","bytes":344,"content_uri":"git:28c19b5eb5a385495c83133f93e2e2a3a527b1c0:workstreams/po03/attempts/po03-wa-b2e7-035-orphan-route-detector/test_output.txt","logical_name":"test_output.txt","media_type":"text/plain","readback_verified_at":"2026-08-22T07:15:59Z","sha256":"94492235f02b7d1a3c3f36fa107d6ed1e74089fd984ff3a159a3a7b6e7a11732"}],"attempt":{"attempt_id":"po03-wa-b2e7-035-orphan-route-detector-attempt-1","checkpoint_seq":1,"fence_token":35,"heartbeat_at":"2026-08-22T07:15:59Z","idempotency_key":"COM-PO03-REPOSITORY-ENGINEERING-PORTABLE-RUNTIME-20260822-v001:po03-wa-b2e7-035-orphan-route-detector:attempt-1","lease_id":"lease-po03-wa-b2e7-035-orphan-route-detector-1","provider_run_id":"NOT_SUPPORTED","worker_id":"po03-wa-b2e7-035-orphan-route-detector-producer"},"commission_id":"COM-PO03-REPOSITORY-ENGINEERING-PORTABLE-RUNTIME-20260822-v001","completion_actor":"coordinator","immutable_input_manifest_sha256":"6ffc52d5abe8a31e0417d99ffe6b3c59093556b0f73894c8d817f11f669c1d67","independent_acceptance":{"receipt_uri":"git:92d71d2b17b71048220e8551e6a3eba3e8743328:workstreams/po03/evaluation/review-b/reviews/po03-wa-b2e7-035-orphan-route-detector.json","reviewer_id":"po03-reviewer-b-claude-sonnet-5","state":"ACCEPTED"},"obzio_state":"COMPLETED","protocol_version":"OBZIO-TRANSACTIONAL-RESULT-v1","provider_state":"RUNNING","result_transaction":{"artifact_count":4,"committed_at":"2026-08-22T07:15:59Z","manifest_sha256":"ac6f1c558b09c8733889268527525a716100caf216e7334c334a8d2db28993f6","manifest_uri":"git:refs/heads/po03/wa-b2e7-c5:workstreams/po03/attempts/po03-wa-b2e7-035-orphan-route-detector/manifest.json","parent_ingested_at":"2026-08-22T07:27:56Z","result_commit_id":"28c19b5eb5a385495c83133f93e2e2a3a527b1c0","result_txn_id":"result-po03-wa-b2e7-035-orphan-route-detector-1","state":"COMMITTED","total_bytes":9501,"verified_at":"2026-08-22T07:15:59Z"},"task_id":"po03-wa-b2e7-035-orphan-route-detector"}
