{
  "acceptance_contract_sha256": "b46620e26cec19872279f0a0ac9aefbc562436c808b1ebea8a078b58e2c8585a",
  "artifacts": [],
  "attempt": {
    "attempt_id": "PO03-WA-064-A01",
    "checkpoint_seq": 0,
    "fence_token": 1,
    "heartbeat_at": null,
    "idempotency_key": "po03:100bc20:wa-064:a01",
    "lease_id": "lease-po03-wa-064-a01",
    "provider_run_id": "PENDING_PROVIDER_ASSIGNMENT",
    "worker_id": "PENDING_PROVIDER_ASSIGNMENT"
  },
  "commission_id": "COM-PO03-REPOSITORY-ENGINEERING-PORTABLE-RUNTIME-20260822-v001",
  "completion_actor": null,
  "immutable_input_manifest_sha256": "bc449d9ea6556ed65d5d11ee53044e58b8f8e5543267f7e30af05a94e07a3b8b",
  "independent_acceptance": {
    "receipt_uri": null,
    "reviewer_id": null,
    "state": "NOT_TESTED"
  },
  "obzio_state": "LEASED",
  "protocol_version": "OBZIO-TRANSACTIONAL-RESULT-v1",
  "provider_state": "UNKNOWN",
  "result_transaction": {
    "artifact_count": 0,
    "committed_at": null,
    "manifest_sha256": null,
    "manifest_uri": null,
    "parent_ingested_at": null,
    "result_commit_id": null,
    "result_txn_id": "txn-po03-wa-064-a01",
    "state": "RESERVED",
    "total_bytes": 0,
    "verified_at": null
  },
  "task_id": "PO03-WA-064"
}
