{"acceptance_contract_sha256":"65d11c464340daea8fb690b85d7f083c50d824e8bf3ce4fbbe8c080acc5a8b25","artifacts":[],"attempt":{"attempt_id":"po03-wa-b2e7-026-provenance-chain-attempt-1","checkpoint_seq":0,"fence_token":26,"heartbeat_at":null,"idempotency_key":"COM-PO03-REPOSITORY-ENGINEERING-PORTABLE-RUNTIME-20260822-v001:po03-wa-b2e7-026-provenance-chain:attempt-1","lease_id":"lease-po03-wa-b2e7-026-provenance-chain-1","provider_run_id":"PENDING_PROVIDER_ASSIGNMENT","worker_id":"PENDING_WORKER_ASSIGNMENT"},"commission_id":"COM-PO03-REPOSITORY-ENGINEERING-PORTABLE-RUNTIME-20260822-v001","completion_actor":null,"immutable_input_manifest_sha256":"625439949a61ecf307f22340e9c66473aef848a0e65c69f7c4c5a50a93883831","independent_acceptance":{"receipt_uri":null,"reviewer_id":null,"state":"NOT_TESTED"},"obzio_state":"CREATED","protocol_version":"OBZIO-TRANSACTIONAL-RESULT-v1","provider_state":"QUEUED","result_transaction":{"artifact_count":0,"committed_at":null,"manifest_sha256":null,"manifest_uri":null,"parent_ingested_at":null,"result_commit_id":null,"result_txn_id":"result-po03-wa-b2e7-026-provenance-chain-1","state":"RESERVED","total_bytes":0,"verified_at":null},"task_id":"po03-wa-b2e7-026-provenance-chain"}
