{"acceptance_contract_sha256":"ddd7539b4f721f7036bb42b441cca01751e648fca2eba6cf39e5824376f6eeba","artifacts":[],"attempt":{"attempt_id":"po03-wa-b2e7-039-unique-evidence-deletion-guard-attempt-1","checkpoint_seq":0,"fence_token":39,"heartbeat_at":null,"idempotency_key":"COM-PO03-REPOSITORY-ENGINEERING-PORTABLE-RUNTIME-20260822-v001:po03-wa-b2e7-039-unique-evidence-deletion-guard:attempt-1","lease_id":"lease-po03-wa-b2e7-039-unique-evidence-deletion-guard-1","provider_run_id":"PENDING_PROVIDER_ASSIGNMENT","worker_id":"PENDING_WORKER_ASSIGNMENT"},"commission_id":"COM-PO03-REPOSITORY-ENGINEERING-PORTABLE-RUNTIME-20260822-v001","completion_actor":null,"immutable_input_manifest_sha256":"929d2314e20de9cf08b44ad2fa2544ba98983ae62a40a264dcd9e155082d0726","independent_acceptance":{"receipt_uri":null,"reviewer_id":null,"state":"NOT_TESTED"},"obzio_state":"CREATED","protocol_version":"OBZIO-TRANSACTIONAL-RESULT-v1","provider_state":"QUEUED","result_transaction":{"artifact_count":0,"committed_at":null,"manifest_sha256":null,"manifest_uri":null,"parent_ingested_at":null,"result_commit_id":null,"result_txn_id":"result-po03-wa-b2e7-039-unique-evidence-deletion-guard-1","state":"RESERVED","total_bytes":0,"verified_at":null},"task_id":"po03-wa-b2e7-039-unique-evidence-deletion-guard"}
