{
  "acceptance_contract_sha256": "f0b91586c103386de1dfbe2aade5ffc408a25ece2a283777d86b9d053449a3f7",
  "artifacts": [
    {
      "artifact_id": "a5-u04-art-01",
      "bytes": 4466,
      "content_uri": "git:cursor/po03-a5-research-conversion-ed20@cab6359637967b6fd8af35e82b7d2bfc54ad3a17:workstreams/po03/research/lib/context_admission_u04.py",
      "logical_name": "context_admission_u04.py",
      "media_type": "text/x-python",
      "readback_verified_at": "2026-08-22T07:35:30Z",
      "sha256": "232b1d292b9f94aa71ec427e8803274d79eff9f389f348f7feda22d211171a78"
    },
    {
      "artifact_id": "a5-u04-art-02",
      "bytes": 1545,
      "content_uri": "git:cursor/po03-a5-research-conversion-ed20@cab6359637967b6fd8af35e82b7d2bfc54ad3a17:workstreams/po03/research/output/a5-u04-result.json",
      "logical_name": "a5-u04-result.json",
      "media_type": "application/json",
      "readback_verified_at": "2026-08-22T07:35:30Z",
      "sha256": "428be1763b9f837dbd61b6b6cf7604c1d9138712081a07477f05f9622c9c78bc"
    },
    {
      "artifact_id": "a5-u04-art-03",
      "bytes": 4700,
      "content_uri": "git:cursor/po03-a5-research-conversion-ed20@cab6359637967b6fd8af35e82b7d2bfc54ad3a17:workstreams/po03/research/repro/run_u04_capsule_vs_dump.py",
      "logical_name": "run_u04_capsule_vs_dump.py",
      "media_type": "text/x-python",
      "readback_verified_at": "2026-08-22T07:35:30Z",
      "sha256": "67dae6e94889517b9445b9d938663c3df72f659a0ce62bb73aaf35cff6dbe725"
    },
    {
      "artifact_id": "a5-u04-art-04",
      "bytes": 2446,
      "content_uri": "git:cursor/po03-a5-research-conversion-ed20@cab6359637967b6fd8af35e82b7d2bfc54ad3a17:workstreams/po03/tests/test_a5_context_admission_u04.py",
      "logical_name": "test_a5_context_admission_u04.py",
      "media_type": "text/x-python",
      "readback_verified_at": "2026-08-22T07:35:30Z",
      "sha256": "0834dcb0894fda39458385ea40ff341963eae41c74629aea67b600838992db56"
    }
  ],
  "attempt": {
    "attempt_id": "a5-u04-attempt-1",
    "checkpoint_seq": 4,
    "fence_token": 1,
    "heartbeat_at": "2026-08-22T07:35:30Z",
    "idempotency_key": "a5-u04:c150ebd9172aec42",
    "lease_id": "lease-a5-u04-1",
    "provider_run_id": "po03-a5-subagent",
    "worker_id": "po03-worker-a5"
  },
  "commission_id": "COM-PO03-REPOSITORY-ENGINEERING-PORTABLE-RUNTIME-20260822-v001",
  "completion_actor": null,
  "immutable_input_manifest_sha256": "c150ebd9172aec424d5e49f28825c949ef04760837970ddac93a10f6d8c088ad",
  "independent_acceptance": {
    "receipt_uri": null,
    "reviewer_id": null,
    "state": "NOT_TESTED"
  },
  "obzio_state": "RESULT_COMMITTED",
  "protocol_version": "OBZIO-TRANSACTIONAL-RESULT-v1",
  "provider_state": "COMPLETED",
  "result_transaction": {
    "artifact_count": 4,
    "committed_at": "2026-08-22T07:35:30Z",
    "manifest_sha256": "79d92e22cbe192587d4560f87596fece0731b71afe2417636befce52f2f16031",
    "manifest_uri": "git:cursor/po03-a5-research-conversion-ed20@cab6359637967b6fd8af35e82b7d2bfc54ad3a17:a5-u04",
    "parent_ingested_at": null,
    "result_commit_id": "cab6359637967b6fd8af35e82b7d2bfc54ad3a17",
    "result_txn_id": "a5-u04-txn-1",
    "state": "COMMITTED",
    "total_bytes": 13157,
    "verified_at": "2026-08-22T07:35:30Z"
  },
  "task_id": "a5-u04"
}
