{"acceptance_contract_sha256":"6e493513785b076f73c4c4d5b06a27e7a2b9a890271605fd9418ccd77c6d7c9e","artifacts":[{"artifact_id":"po03-wa-b2e7-017-pack-qualification-engine-artifact-001","bytes":4156,"content_uri":"git:9757738d64f46f2cee87a6b397de9096e7b852cf:workstreams/po03/attempts/po03-wa-b2e7-017-pack-qualification-engine/qualify_pack.py","logical_name":"qualify_pack.py","media_type":"text/x-python","readback_verified_at":"2026-08-22T07:21:27Z","sha256":"f26d1f829fa65514eb195e48fb5ff7b5566d04dda1babe750028c3315aff0da1"},{"artifact_id":"po03-wa-b2e7-017-pack-qualification-engine-artifact-002","bytes":7385,"content_uri":"git:9757738d64f46f2cee87a6b397de9096e7b852cf:workstreams/po03/attempts/po03-wa-b2e7-017-pack-qualification-engine/test_output.txt","logical_name":"test_output.txt","media_type":"text/plain","readback_verified_at":"2026-08-22T07:21:27Z","sha256":"1fea7d7ab964f86abe3c8211795e6bed44a6a5b149913170c9314ab9f2c255ae"},{"artifact_id":"po03-wa-b2e7-017-pack-qualification-engine-artifact-003","bytes":1616,"content_uri":"git:9757738d64f46f2cee87a6b397de9096e7b852cf:workstreams/po03/attempts/po03-wa-b2e7-017-pack-qualification-engine/test_qualify_pack.py","logical_name":"test_qualify_pack.py","media_type":"text/x-python","readback_verified_at":"2026-08-22T07:21:27Z","sha256":"cdefc7b2b1254018eaed4c99cf3a898763f581ba3a777b6cb797ad1befe6b8e4"}],"attempt":{"attempt_id":"po03-wa-b2e7-017-pack-qualification-engine-attempt-1","checkpoint_seq":1,"fence_token":17,"heartbeat_at":"2026-08-22T07:21:27Z","idempotency_key":"COM-PO03-REPOSITORY-ENGINEERING-PORTABLE-RUNTIME-20260822-v001:po03-wa-b2e7-017-pack-qualification-engine:attempt-1","lease_id":"lease-po03-wa-b2e7-017-pack-qualification-engine-1","provider_run_id":"NOT_SUPPORTED","worker_id":"po03-wa-b2e7-017-pack-qualification-engine-producer"},"commission_id":"COM-PO03-REPOSITORY-ENGINEERING-PORTABLE-RUNTIME-20260822-v001","completion_actor":"coordinator","immutable_input_manifest_sha256":"6ce09323cc24bedd86baca59c67926b55fcf218999ec528db2c4599a041ac945","independent_acceptance":{"receipt_uri":"git:20ba84b2a9c720f02e2d5cf8d33b1ef0ad59fdf4:workstreams/po03/evaluation/review-a/reviews/po03-wa-b2e7-017-pack-qualification-engine.json","reviewer_id":"po03-reviewer-a-claude-opus-5","state":"ACCEPTED"},"obzio_state":"COMPLETED","protocol_version":"OBZIO-TRANSACTIONAL-RESULT-v1","provider_state":"RUNNING","result_transaction":{"artifact_count":3,"committed_at":"2026-08-22T07:21:27Z","manifest_sha256":"420d70a1dcbf9003a82b061c6301c04b57a8ad4fd23e987b0a3c83aea5fae218","manifest_uri":"git:refs/heads/po03/wa-b2e7-c3:workstreams/po03/attempts/po03-wa-b2e7-017-pack-qualification-engine/manifest.json","parent_ingested_at":"2026-08-22T07:27:56Z","result_commit_id":"9757738d64f46f2cee87a6b397de9096e7b852cf","result_txn_id":"result-po03-wa-b2e7-017-pack-qualification-engine-1","state":"COMMITTED","total_bytes":13157,"verified_at":"2026-08-22T07:21:27Z"},"task_id":"po03-wa-b2e7-017-pack-qualification-engine"}
