{
  "acceptance_contract_sha256": "424607c50c961fb39b0cbcdad8a810242db29fc097f76504e551414a868f4e7f",
  "artifacts": [
    {
      "artifact_id": "a2-u06-art-01",
      "bytes": 385,
      "content_uri": "git:cursor/po03-a2-fault-recovery-ed20@3f354096c30ea171c8edb919c88f03d56ee85e22:workstreams/po03/faults/inject_stale_lease.py",
      "logical_name": "inject_stale_lease.py",
      "media_type": "text/x-python",
      "readback_verified_at": null,
      "sha256": "787ebf4ddbcca44364b240f45b41a5c4c6580ea6483b0f84962df66bd4a79970"
    },
    {
      "artifact_id": "a2-u06-art-02",
      "bytes": 4496,
      "content_uri": "git:cursor/po03-a2-fault-recovery-ed20@3f354096c30ea171c8edb919c88f03d56ee85e22:workstreams/po03/faults/outcomes/a2-u06.json",
      "logical_name": "a2-u06.json",
      "media_type": "application/json",
      "readback_verified_at": null,
      "sha256": "2fa899e164532fe6f6f83026e4d3f56948e7447df50e41cd33c634b69fad58f6"
    },
    {
      "artifact_id": "a2-u06-art-03",
      "bytes": 6934,
      "content_uri": "git:cursor/po03-a2-fault-recovery-ed20@3f354096c30ea171c8edb919c88f03d56ee85e22:workstreams/po03/tests/test_a2_fault_recovery.py",
      "logical_name": "test_a2_fault_recovery.py",
      "media_type": "text/x-python",
      "readback_verified_at": null,
      "sha256": "044e88b83dad1daea3d64d5ce8c2e4532f966ad9d87e09b2903df603da82ff65"
    }
  ],
  "attempt": {
    "attempt_id": "a2-u06-attempt-1",
    "checkpoint_seq": 3,
    "fence_token": 1,
    "heartbeat_at": "2026-08-22T07:15:51Z",
    "idempotency_key": "a2-u06:0eba3434d1f28810",
    "lease_id": "lease-a2-u06-1",
    "provider_run_id": "po03-a2-subagent",
    "worker_id": "po03-worker-a2"
  },
  "commission_id": "COM-PO03-REPOSITORY-ENGINEERING-PORTABLE-RUNTIME-20260822-v001",
  "completion_actor": null,
  "immutable_input_manifest_sha256": "0eba3434d1f2881009ec4ed12008a4e214cbee1452bd84f035ab0d5665d1b7f5",
  "independent_acceptance": {
    "receipt_uri": null,
    "reviewer_id": null,
    "state": "NOT_TESTED"
  },
  "obzio_state": "FAILED_TERMINAL",
  "protocol_version": "OBZIO-TRANSACTIONAL-RESULT-v1",
  "provider_state": "UNKNOWN",
  "result_transaction": {
    "artifact_count": 3,
    "committed_at": null,
    "manifest_sha256": null,
    "manifest_uri": null,
    "parent_ingested_at": null,
    "result_commit_id": null,
    "result_txn_id": "a2-u06-txn-1",
    "state": "RESERVED",
    "total_bytes": 11815,
    "verified_at": null
  },
  "task_id": "a2-u06"
}
