{"acceptance_contract_sha256":"7ee603fb16d3b07450c225a82480c5795183fd2f05b185ad985f5e18a3ed819a","artifacts":[{"artifact_id":"po03-wa-b2e7-034-transport-debris-detector-artifact-001","bytes":4518,"content_uri":"git:0b935b9c76b372e592602f16f050a34f77a86d4d:workstreams/po03/attempts/po03-wa-b2e7-034-transport-debris-detector/__pycache__/transport_debris_detector.cpython-312.pyc","logical_name":"__pycache__/transport_debris_detector.cpython-312.pyc","media_type":"application/x-python-code","readback_verified_at":"2026-08-22T07:19:01Z","sha256":"35c074b1015ce6bd5ec52f50c025f0b5f57d2470e49af29deafa4c4f21b7a03d"},{"artifact_id":"po03-wa-b2e7-034-transport-debris-detector-artifact-002","bytes":347,"content_uri":"git:0b935b9c76b372e592602f16f050a34f77a86d4d:workstreams/po03/attempts/po03-wa-b2e7-034-transport-debris-detector/observed_surface_boundary.txt","logical_name":"observed_surface_boundary.txt","media_type":"text/plain","readback_verified_at":"2026-08-22T07:19:01Z","sha256":"72f3196decc7a62183635ce53734580526b3b29618cc7a33fe118856c79729fe"},{"artifact_id":"po03-wa-b2e7-034-transport-debris-detector-artifact-003","bytes":412,"content_uri":"git:0b935b9c76b372e592602f16f050a34f77a86d4d:workstreams/po03/attempts/po03-wa-b2e7-034-transport-debris-detector/test_output.txt","logical_name":"test_output.txt","media_type":"text/plain","readback_verified_at":"2026-08-22T07:19:01Z","sha256":"19a76cd5c2107cd8faad632156be24c2811af1c4e39c015bf8b3557e4d0f989d"},{"artifact_id":"po03-wa-b2e7-034-transport-debris-detector-artifact-004","bytes":1317,"content_uri":"git:0b935b9c76b372e592602f16f050a34f77a86d4d:workstreams/po03/attempts/po03-wa-b2e7-034-transport-debris-detector/test_transport_debris_detector.py","logical_name":"test_transport_debris_detector.py","media_type":"text/x-python","readback_verified_at":"2026-08-22T07:19:01Z","sha256":"16b05dfdef4e2a3840bba6280e32db58dfd058afc2eed0ffcc1be434e7e0ed14"},{"artifact_id":"po03-wa-b2e7-034-transport-debris-detector-artifact-005","bytes":2672,"content_uri":"git:0b935b9c76b372e592602f16f050a34f77a86d4d:workstreams/po03/attempts/po03-wa-b2e7-034-transport-debris-detector/transport_debris_detector.py","logical_name":"transport_debris_detector.py","media_type":"text/x-python","readback_verified_at":"2026-08-22T07:19:01Z","sha256":"494d5efd2c79ad6e36869d55d9575aa0516b167a7624c0b610020b110a4880cc"}],"attempt":{"attempt_id":"po03-wa-b2e7-034-transport-debris-detector-attempt-1","checkpoint_seq":1,"fence_token":34,"heartbeat_at":"2026-08-22T07:19:01Z","idempotency_key":"COM-PO03-REPOSITORY-ENGINEERING-PORTABLE-RUNTIME-20260822-v001:po03-wa-b2e7-034-transport-debris-detector:attempt-1","lease_id":"lease-po03-wa-b2e7-034-transport-debris-detector-1","provider_run_id":"NOT_SUPPORTED","worker_id":"po03-wa-b2e7-034-transport-debris-detector-producer"},"commission_id":"COM-PO03-REPOSITORY-ENGINEERING-PORTABLE-RUNTIME-20260822-v001","completion_actor":null,"immutable_input_manifest_sha256":"74880bfff5053e5694322be037e12724432cfdfdef6c585294ad412f3acab49f","independent_acceptance":{"receipt_uri":null,"reviewer_id":null,"state":"NOT_TESTED"},"obzio_state":"RESULT_COMMITTED","protocol_version":"OBZIO-TRANSACTIONAL-RESULT-v1","provider_state":"RUNNING","result_transaction":{"artifact_count":5,"committed_at":"2026-08-22T07:19:01Z","manifest_sha256":"4d3f937317a0dc38600bbfb389a77c9fe65619d724469d669d206997cc583c0e","manifest_uri":"git:refs/heads/po03/wa-b2e7-c5:workstreams/po03/attempts/po03-wa-b2e7-034-transport-debris-detector/manifest.json","parent_ingested_at":null,"result_commit_id":"0b935b9c76b372e592602f16f050a34f77a86d4d","result_txn_id":"result-po03-wa-b2e7-034-transport-debris-detector-1","state":"COMMITTED","total_bytes":9266,"verified_at":"2026-08-22T07:19:01Z"},"task_id":"po03-wa-b2e7-034-transport-debris-detector"}
