{"acceptance_contract_sha256":"3297238c1cba3b3b48a6df9fdbccd9a4d9ada2d3b4ec9d5146b476a8262cb58e","artifacts":[],"attempt":{"attempt_id":"wave-a-010-allowlist-git-diff-attempt-1","checkpoint_seq":0,"fence_token":1,"heartbeat_at":null,"idempotency_key":"COM-PO03-REPOSITORY-ENGINEERING-PORTABLE-RUNTIME-20260822-v001:wave-a-010-allowlist-git-diff:attempt-1","lease_id":"lease-wave-a-010-allowlist-git-diff-1","provider_run_id":"PENDING_PROVIDER_ASSIGNMENT","worker_id":"PENDING_WORKER_ASSIGNMENT"},"commission_id":"COM-PO03-REPOSITORY-ENGINEERING-PORTABLE-RUNTIME-20260822-v001","completion_actor":null,"immutable_input_manifest_sha256":"fb82e1bcdc016d0d59c8b07296e9f1acd0b26e649f57bb37942a1518f4685715","independent_acceptance":{"receipt_uri":null,"reviewer_id":null,"state":"NOT_TESTED"},"obzio_state":"CREATED","protocol_version":"OBZIO-TRANSACTIONAL-RESULT-v1","provider_state":"QUEUED","result_transaction":{"artifact_count":0,"committed_at":null,"manifest_sha256":null,"manifest_uri":null,"parent_ingested_at":null,"result_commit_id":null,"result_txn_id":"result-wave-a-010-allowlist-git-diff-1","state":"RESERVED","total_bytes":0,"verified_at":null},"task_id":"wave-a-010-allowlist-git-diff"}
