{
  "acceptance_contract_sha256": "9365588ee1a6c0a457fc1237a3f7ff6a24103773190c523579032ebcc3efee1b",
  "artifacts": [
    {
      "artifact_id": "PO03-WA-061:adversarial_gate.py",
      "bytes": 3355,
      "content_uri": "workstreams/po03/runs/wave-a/route-08/PO03-WA-061/adversarial_gate.py",
      "logical_name": "adversarial_gate.py",
      "media_type": "text/x-python",
      "readback_verified_at": "2026-08-22T08:42:51.512337Z",
      "sha256": "ed17cd7e130d65233ee3e9ca49590bee4a1a50b3b7ea74661d6281c8dcfb5495"
    },
    {
      "artifact_id": "PO03-WA-061:observed-result.json",
      "bytes": 6065,
      "content_uri": "workstreams/po03/runs/wave-a/route-08/PO03-WA-061/observed-result.json",
      "logical_name": "observed-result.json",
      "media_type": "application/json",
      "readback_verified_at": "2026-08-22T08:42:51.512337Z",
      "sha256": "b1bd48d74fb9d96a3b1089ce2e83b40d0331f0edbdbad73834729dfcfc2a1f79"
    },
    {
      "artifact_id": "PO03-WA-061:test_adversarial_gate.py",
      "bytes": 640,
      "content_uri": "workstreams/po03/runs/wave-a/route-08/PO03-WA-061/test_adversarial_gate.py",
      "logical_name": "test_adversarial_gate.py",
      "media_type": "text/x-python",
      "readback_verified_at": "2026-08-22T08:42:51.512337Z",
      "sha256": "123324a963c7bf400aefdfd124f99525331970b633f02fbdf4011c0753adfc6b"
    },
    {
      "artifact_id": "PO03-WA-061:manifest.json",
      "bytes": 1620,
      "content_uri": "workstreams/po03/runs/wave-a/route-08/PO03-WA-061/manifest.json",
      "logical_name": "manifest.json",
      "media_type": "application/json",
      "readback_verified_at": "2026-08-22T08:42:51.512337Z",
      "sha256": "0d74cae43651df47fd94d69260fa331f1dd3d6590c01fea47fed1655c2f34cad"
    }
  ],
  "attempt": {
    "attempt_id": "PO03-WA-061-attempt-1",
    "checkpoint_seq": 1,
    "fence_token": 1,
    "heartbeat_at": null,
    "idempotency_key": "PO03-WAVE-A-20260822:PO03-WA-061:attempt-1",
    "lease_id": "lease-PO03-WA-061-1",
    "provider_run_id": "bc-aa38db59-c61c-4e29-9c26-4424b20f6e19",
    "worker_id": "route-08-material-worker"
  },
  "commission_id": "COM-PO03-REPOSITORY-ENGINEERING-PORTABLE-RUNTIME-20260822-v001",
  "completion_actor": "coordinator",
  "immutable_input_manifest_sha256": "f66ba25343ceb8ce7810a7b241dd80b042b3b888ba498dcd61e48a29863c2f66",
  "independent_acceptance": {
    "receipt_uri": null,
    "reviewer_id": null,
    "state": "PENDING"
  },
  "obzio_state": "COMPLETED",
  "protocol_version": "OBZIO-TRANSACTIONAL-RESULT-v1",
  "provider_state": "COMPLETED",
  "result_transaction": {
    "artifact_count": 4,
    "committed_at": "2026-08-22T08:36:27+00:00",
    "manifest_sha256": "0d74cae43651df47fd94d69260fa331f1dd3d6590c01fea47fed1655c2f34cad",
    "manifest_uri": "workstreams/po03/runs/wave-a/route-08/PO03-WA-061/manifest.json",
    "parent_ingested_at": "2026-08-22T08:42:51.512337Z",
    "result_commit_id": "9a87a25677c68bafbcc7bf739d2ff2c60cb386b0",
    "result_txn_id": "rtxn-PO03-WA-061-attempt-1",
    "state": "INGESTED",
    "total_bytes": 11680,
    "verified_at": "2026-08-22T08:42:51.512337Z"
  },
  "task_id": "PO03-WA-061"
}
