{
  "acceptance_contract_sha256": "9a2290aec4e0219c85aa2392e6ffd78a48a56248399e4824a86704de03427a83",
  "artifacts": [
    {
      "artifact_id": "PO03-WA-043:source.json",
      "bytes": 947,
      "content_uri": "workstreams/po03/runs/wave-a/route-06/PO03-WA-043/source.json",
      "logical_name": "source.json",
      "media_type": "application/json",
      "readback_verified_at": null,
      "sha256": "be81db84e636f19c6148265f8d4f973c0c437e6a66b635689571a40507817ddc"
    },
    {
      "artifact_id": "PO03-WA-043:frozen-hypothesis.json",
      "bytes": 532,
      "content_uri": "workstreams/po03/runs/wave-a/route-06/PO03-WA-043/frozen-hypothesis.json",
      "logical_name": "frozen-hypothesis.json",
      "media_type": "application/json",
      "readback_verified_at": null,
      "sha256": "31b0629edfddc887045cce8deac32e58a37333082160adcf0aadaf667dcc7854"
    },
    {
      "artifact_id": "PO03-WA-043:fixture.json",
      "bytes": 223,
      "content_uri": "workstreams/po03/runs/wave-a/route-06/PO03-WA-043/fixture.json",
      "logical_name": "fixture.json",
      "media_type": "application/json",
      "readback_verified_at": null,
      "sha256": "8f844f0b1a9ebb0eb9e855fa00f8a96c853b57aac547ff97af83aa613a0ea595"
    },
    {
      "artifact_id": "PO03-WA-043:reproduction.json",
      "bytes": 633,
      "content_uri": "workstreams/po03/runs/wave-a/route-06/PO03-WA-043/reproduction.json",
      "logical_name": "reproduction.json",
      "media_type": "application/json",
      "readback_verified_at": null,
      "sha256": "8f72a447b8a87d0288738bee5901d6aaaeedc1b94f0fe616c21cd1682a08032f"
    },
    {
      "artifact_id": "PO03-WA-043:observed-result.json",
      "bytes": 618,
      "content_uri": "workstreams/po03/runs/wave-a/route-06/PO03-WA-043/observed-result.json",
      "logical_name": "observed-result.json",
      "media_type": "application/json",
      "readback_verified_at": null,
      "sha256": "2905df1b3b518a55fb911d886601a09c4ab72bd5171af791bd06542b8b06a5e7"
    },
    {
      "artifact_id": "PO03-WA-043:mechanism.py",
      "bytes": 2037,
      "content_uri": "workstreams/po03/runs/wave-a/route-06/PO03-WA-043/mechanism.py",
      "logical_name": "mechanism.py",
      "media_type": "text/x-python",
      "readback_verified_at": null,
      "sha256": "80f2a1e64506bc11fd224ce5c979346122f0fe51d82c6889c2ced8d18a2d4f5b"
    },
    {
      "artifact_id": "PO03-WA-043:mechanism-change.json",
      "bytes": 547,
      "content_uri": "workstreams/po03/runs/wave-a/route-06/PO03-WA-043/mechanism-change.json",
      "logical_name": "mechanism-change.json",
      "media_type": "application/json",
      "readback_verified_at": null,
      "sha256": "726cc6f122af3dc1d721746277bd4b96ac50c32bc6eaba70e636b3f2b9142e59"
    },
    {
      "artifact_id": "PO03-WA-043:test_mechanism.py",
      "bytes": 939,
      "content_uri": "workstreams/po03/runs/wave-a/route-06/PO03-WA-043/test_mechanism.py",
      "logical_name": "test_mechanism.py",
      "media_type": "text/x-python",
      "readback_verified_at": null,
      "sha256": "bd6d2c428900e6361a82c7e29e1351805737f0c596297aee818268ae644bd3c8"
    },
    {
      "artifact_id": "PO03-WA-043:recurrence-test.json",
      "bytes": 1033,
      "content_uri": "workstreams/po03/runs/wave-a/route-06/PO03-WA-043/recurrence-test.json",
      "logical_name": "recurrence-test.json",
      "media_type": "application/json",
      "readback_verified_at": null,
      "sha256": "98105eae6b8fe2e154431a8bc93b436a4e90fb2d166a10173a673b6049f5ba8e"
    },
    {
      "artifact_id": "PO03-WA-043:strategy-proposal.json",
      "bytes": 410,
      "content_uri": "workstreams/po03/runs/wave-a/route-06/PO03-WA-043/strategy-proposal.json",
      "logical_name": "strategy-proposal.json",
      "media_type": "application/json",
      "readback_verified_at": null,
      "sha256": "e2a48a9f8c6d1d17cba26cca9d12cbd8042d7f25e08ff3d39f3bb154891256fe"
    },
    {
      "artifact_id": "PO03-WA-043:artifact-manifest.json",
      "bytes": 4198,
      "content_uri": "workstreams/po03/runs/wave-a/route-06/PO03-WA-043/artifact-manifest.json",
      "logical_name": "artifact-manifest.json",
      "media_type": "application/json",
      "readback_verified_at": null,
      "sha256": "c1885d229a8d754be01110cd4b27f8ce8f844617fdb90b839a815769e3236450"
    }
  ],
  "attempt": {
    "attempt_id": "PO03-WA-043:attempt-1",
    "checkpoint_seq": 1,
    "fence_token": 1,
    "heartbeat_at": "2026-08-22T07:11:01.526734+00:00",
    "idempotency_key": "PO03-WAVE-A-20260822:PO03-WA-043:attempt-1",
    "lease_id": "lease-PO03-WA-043-1",
    "provider_run_id": "bc-aa38db59-c61c-4e29-9c26-4424b20f6e19",
    "worker_id": "route-06-material-worker-gpt-5.6-sol-xhigh"
  },
  "commission_id": "COM-PO03-REPOSITORY-ENGINEERING-PORTABLE-RUNTIME-20260822-v001",
  "completion_actor": null,
  "immutable_input_manifest_sha256": "f66ba25343ceb8ce7810a7b241dd80b042b3b888ba498dcd61e48a29863c2f66",
  "independent_acceptance": {
    "receipt_uri": null,
    "reviewer_id": null,
    "state": "NOT_TESTED"
  },
  "obzio_state": "RESULT_STAGED",
  "protocol_version": "OBZIO-TRANSACTIONAL-RESULT-v1",
  "provider_state": "RUNNING",
  "result_transaction": {
    "artifact_count": 11,
    "committed_at": null,
    "manifest_sha256": "c1885d229a8d754be01110cd4b27f8ce8f844617fdb90b839a815769e3236450",
    "manifest_uri": "workstreams/po03/runs/wave-a/route-06/PO03-WA-043/artifact-manifest.json",
    "parent_ingested_at": null,
    "result_commit_id": null,
    "result_txn_id": "PO03-WAVE-A-20260822:PO03-WA-043:result-1",
    "state": "STAGED",
    "total_bytes": 12117,
    "verified_at": null
  },
  "task_id": "PO03-WA-043"
}
