{"acceptance_contract_sha256":"6662478b462e6a52b6d005f42213fc4a84b7808f88029f7cf0102c2c21325fcc","artifacts":[{"artifact_id":"po03-wa-b2e7-045-stale-lease-fencing-artifact-001","bytes":7328,"content_uri":"git:4402d534f9767cc28205cb6272de1fd740f75a5f:workstreams/po03/attempts/po03-wa-b2e7-045-stale-lease-fencing/defect-record.json","logical_name":"defect-record.json","media_type":"application/json","readback_verified_at":"2026-08-22T07:46:18Z","sha256":"5e0bc851796f18ee91ebf303165c9042165116f73e4f8b73a0a2f0b6152a2be8"},{"artifact_id":"po03-wa-b2e7-045-stale-lease-fencing-artifact-002","bytes":5872,"content_uri":"git:4402d534f9767cc28205cb6272de1fd740f75a5f:workstreams/po03/attempts/po03-wa-b2e7-045-stale-lease-fencing/fault_kit.py","logical_name":"fault_kit.py","media_type":"text/x-python","readback_verified_at":"2026-08-22T07:46:18Z","sha256":"d68c0ec92cc93741287fc8fb73360fecd077f22f347128ffee24314ccdfacadb"},{"artifact_id":"po03-wa-b2e7-045-stale-lease-fencing-artifact-003","bytes":1811,"content_uri":"git:4402d534f9767cc28205cb6272de1fd740f75a5f:workstreams/po03/attempts/po03-wa-b2e7-045-stale-lease-fencing/fence_child.py","logical_name":"fence_child.py","media_type":"text/x-python","readback_verified_at":"2026-08-22T07:46:18Z","sha256":"fc98a74f7ded70f88bfcd1ef53e4e0fcde942cb9eeea6cd3536568cfef8cdfaf"},{"artifact_id":"po03-wa-b2e7-045-stale-lease-fencing-artifact-004","bytes":3978,"content_uri":"git:4402d534f9767cc28205cb6272de1fd740f75a5f:workstreams/po03/attempts/po03-wa-b2e7-045-stale-lease-fencing/injection-report.json","logical_name":"injection-report.json","media_type":"application/json","readback_verified_at":"2026-08-22T07:46:18Z","sha256":"a5d5ea80d7a55a822858970ad5a8a4dc38e9909412a0d55ac4b13db7b0eb8aa0"},{"artifact_id":"po03-wa-b2e7-045-stale-lease-fencing-artifact-005","bytes":13365,"content_uri":"git:4402d534f9767cc28205cb6272de1fd740f75a5f:workstreams/po03/attempts/po03-wa-b2e7-045-stale-lease-fencing/lease_fencing_injector.py","logical_name":"lease_fencing_injector.py","media_type":"text/x-python","readback_verified_at":"2026-08-22T07:46:18Z","sha256":"40127c264f14ad6f1c4830e4bbb26d5bcb985cf22a16cf33257e4e48bce8a932"},{"artifact_id":"po03-wa-b2e7-045-stale-lease-fencing-artifact-006","bytes":4724,"content_uri":"git:4402d534f9767cc28205cb6272de1fd740f75a5f:workstreams/po03/attempts/po03-wa-b2e7-045-stale-lease-fencing/repair_candidate_fencing.py","logical_name":"repair_candidate_fencing.py","media_type":"text/x-python","readback_verified_at":"2026-08-22T07:46:18Z","sha256":"ee1beb393191fd8d7e3087defc263aedb1563b9b477a46f6dd6a7cd799ac00ed"},{"artifact_id":"po03-wa-b2e7-045-stale-lease-fencing-artifact-007","bytes":2607,"content_uri":"git:4402d534f9767cc28205cb6272de1fd740f75a5f:workstreams/po03/attempts/po03-wa-b2e7-045-stale-lease-fencing/test-output.txt","logical_name":"test-output.txt","media_type":"text/plain","readback_verified_at":"2026-08-22T07:46:18Z","sha256":"34b6e035b08fc75be118294ec611b7161827008b92aac6005ff9ead7dc5bc992"},{"artifact_id":"po03-wa-b2e7-045-stale-lease-fencing-artifact-008","bytes":7359,"content_uri":"git:4402d534f9767cc28205cb6272de1fd740f75a5f:workstreams/po03/attempts/po03-wa-b2e7-045-stale-lease-fencing/test_stale_lease_fencing.py","logical_name":"test_stale_lease_fencing.py","media_type":"text/x-python","readback_verified_at":"2026-08-22T07:46:18Z","sha256":"478999d523dc57f8ed96577ea0512229e13fde7f2db34eeb38878472dde5c652"}],"attempt":{"attempt_id":"po03-wa-b2e7-045-stale-lease-fencing-attempt-1","checkpoint_seq":1,"fence_token":45,"heartbeat_at":"2026-08-22T07:46:18Z","idempotency_key":"COM-PO03-REPOSITORY-ENGINEERING-PORTABLE-RUNTIME-20260822-v001:po03-wa-b2e7-045-stale-lease-fencing:attempt-1","lease_id":"lease-po03-wa-b2e7-045-stale-lease-fencing-1","provider_run_id":"NOT_SUPPORTED","worker_id":"po03-wa-b2e7-045-stale-lease-fencing-producer"},"commission_id":"COM-PO03-REPOSITORY-ENGINEERING-PORTABLE-RUNTIME-20260822-v001","completion_actor":null,"immutable_input_manifest_sha256":"819e835d7c005d9bed89c8104953cf4f27738ac6159a8a2ed19292c6dcb98240","independent_acceptance":{"receipt_uri":null,"reviewer_id":null,"state":"NOT_TESTED"},"obzio_state":"RESULT_COMMITTED","protocol_version":"OBZIO-TRANSACTIONAL-RESULT-v1","provider_state":"RUNNING","result_transaction":{"artifact_count":8,"committed_at":"2026-08-22T07:46:18Z","manifest_sha256":"46410580187d833e4f9d8d80a8e25270979ddef76eb1f2c52836dd6d275df080","manifest_uri":"git:refs/heads/po03/wa-b2e7-c6:workstreams/po03/attempts/po03-wa-b2e7-045-stale-lease-fencing/manifest.json","parent_ingested_at":null,"result_commit_id":"4402d534f9767cc28205cb6272de1fd740f75a5f","result_txn_id":"result-po03-wa-b2e7-045-stale-lease-fencing-1","state":"COMMITTED","total_bytes":47044,"verified_at":"2026-08-22T07:46:18Z"},"task_id":"po03-wa-b2e7-045-stale-lease-fencing"}
