{"acceptance_contract_sha256":"9d1722d005ee9be7ed51059fd0855aeeb603ba863abec71f274b6857a5ce6f12","artifacts":[{"artifact_id":"po03-wa-b2e7-011-alias-resolution-artifact-001","bytes":5639,"content_uri":"git:caec8dcda47141660836781dd1f983ea6a2f5b7f:workstreams/po03/attempts/po03-wa-b2e7-011-alias-resolution/EVIDENCE.md","logical_name":"EVIDENCE.md","media_type":"text/markdown","readback_verified_at":"2026-08-22T07:27:18Z","sha256":"dfe6de1d7541daa9429abd29f8a1b6ff6d84aff9a2cfff8a62a54801f2b4904a"},{"artifact_id":"po03-wa-b2e7-011-alias-resolution-artifact-002","bytes":7529,"content_uri":"git:caec8dcda47141660836781dd1f983ea6a2f5b7f:workstreams/po03/attempts/po03-wa-b2e7-011-alias-resolution/alias_resolver.py","logical_name":"alias_resolver.py","media_type":"text/x-python","readback_verified_at":"2026-08-22T07:27:18Z","sha256":"5bae7bb035753ed18a3a5e665d2c6c6e9ff0e0fc90c1fd0ff2521e2096c0d1ae"},{"artifact_id":"po03-wa-b2e7-011-alias-resolution-artifact-003","bytes":7786,"content_uri":"git:caec8dcda47141660836781dd1f983ea6a2f5b7f:workstreams/po03/attempts/po03-wa-b2e7-011-alias-resolution/test_alias_resolver.py","logical_name":"test_alias_resolver.py","media_type":"text/x-python","readback_verified_at":"2026-08-22T07:27:18Z","sha256":"f02b19d4ab0d8df9a5b4e63b7c37484370816b5dcbceccc3260a43b39d3d5c86"}],"attempt":{"attempt_id":"po03-wa-b2e7-011-alias-resolution-attempt-1","checkpoint_seq":1,"fence_token":11,"heartbeat_at":"2026-08-22T07:27:18Z","idempotency_key":"COM-PO03-REPOSITORY-ENGINEERING-PORTABLE-RUNTIME-20260822-v001:po03-wa-b2e7-011-alias-resolution:attempt-1","lease_id":"lease-po03-wa-b2e7-011-alias-resolution-1","provider_run_id":"NOT_SUPPORTED","worker_id":"po03-wa-b2e7-011-alias-resolution-producer"},"commission_id":"COM-PO03-REPOSITORY-ENGINEERING-PORTABLE-RUNTIME-20260822-v001","completion_actor":null,"immutable_input_manifest_sha256":"8796fd1c1f85b2fa477becae5c5c55e7355b138503c8d16b2bbabbe820748300","independent_acceptance":{"receipt_uri":null,"reviewer_id":null,"state":"NOT_TESTED"},"obzio_state":"RESULT_COMMITTED","protocol_version":"OBZIO-TRANSACTIONAL-RESULT-v1","provider_state":"RUNNING","result_transaction":{"artifact_count":3,"committed_at":"2026-08-22T07:27:18Z","manifest_sha256":"33c2b8c6aa64a119600206dd56d16921d51cb78f851425a172314c83bcaf6102","manifest_uri":"git:refs/heads/po03/wa-b2e7-c2:workstreams/po03/attempts/po03-wa-b2e7-011-alias-resolution/manifest.json","parent_ingested_at":null,"result_commit_id":"caec8dcda47141660836781dd1f983ea6a2f5b7f","result_txn_id":"result-po03-wa-b2e7-011-alias-resolution-1","state":"COMMITTED","total_bytes":20954,"verified_at":"2026-08-22T07:27:18Z"},"task_id":"po03-wa-b2e7-011-alias-resolution"}
