{
  "acceptance_contract_sha256": "a75f1665842a4deb5e00a3f2bbfb4f4c9a17d83bb093c9428f580a01fdbab3a9",
  "artifacts": [
    {
      "artifact_id": "a1-u02-art-01",
      "bytes": 3021,
      "content_uri": "git:cursor/po03-a1-custody-engine-ed20@00c0de96bd395adbe6623edbe9a076f91f982c93:workstreams/po03/control/units/a1/a1-u02-run-summary.json",
      "logical_name": "a1-u02-run-summary.json",
      "media_type": "application/json",
      "readback_verified_at": "2026-08-22T07:25:08Z",
      "sha256": "9a89a542ab1dacd482e9962892f93741782f90976a32099390395b84edc9d78b"
    },
    {
      "artifact_id": "a1-u02-art-02",
      "bytes": 11518,
      "content_uri": "git:cursor/po03-a1-custody-engine-ed20@00c0de96bd395adbe6623edbe9a076f91f982c93:workstreams/po03/engine/outbox.py",
      "logical_name": "outbox.py",
      "media_type": "text/x-python",
      "readback_verified_at": "2026-08-22T07:25:08Z",
      "sha256": "c631c0e3734cf2f29719509c024e6a26fea136a2a9c48f080f79c3021aac3e54"
    },
    {
      "artifact_id": "a1-u02-art-03",
      "bytes": 10692,
      "content_uri": "git:cursor/po03-a1-custody-engine-ed20@00c0de96bd395adbe6623edbe9a076f91f982c93:workstreams/po03/tests/test_a1_outbox.py",
      "logical_name": "test_a1_outbox.py",
      "media_type": "text/x-python",
      "readback_verified_at": "2026-08-22T07:25:08Z",
      "sha256": "32c4ecbbdce9ab527f555c38e988c1e0e93a06a099f9d84a29dfec67753328e3"
    }
  ],
  "attempt": {
    "attempt_id": "a1-u02-attempt-1",
    "checkpoint_seq": 3,
    "fence_token": 1,
    "heartbeat_at": "2026-08-22T07:25:08Z",
    "idempotency_key": "a1-u02:0c850af364fd6874",
    "lease_id": "lease-a1-u02-1",
    "provider_run_id": "po03-a1-subagent",
    "worker_id": "po03-worker-a1"
  },
  "commission_id": "COM-PO03-REPOSITORY-ENGINEERING-PORTABLE-RUNTIME-20260822-v001",
  "completion_actor": null,
  "immutable_input_manifest_sha256": "0c850af364fd687446ad6a5d649ddec8f6502ad775ab6ea1ae3b65526ec30dc5",
  "independent_acceptance": {
    "receipt_uri": null,
    "reviewer_id": null,
    "state": "NOT_TESTED"
  },
  "obzio_state": "RESULT_COMMITTED",
  "protocol_version": "OBZIO-TRANSACTIONAL-RESULT-v1",
  "provider_state": "COMPLETED",
  "result_transaction": {
    "artifact_count": 3,
    "committed_at": "2026-08-22T07:25:08Z",
    "manifest_sha256": "ab316bcc9be75208a91e6f6636bb7386d9ba451789869b91b11f21885cd55c2e",
    "manifest_uri": "git:cursor/po03-a1-custody-engine-ed20@00c0de96bd395adbe6623edbe9a076f91f982c93:a1-u02",
    "parent_ingested_at": null,
    "result_commit_id": "00c0de96bd395adbe6623edbe9a076f91f982c93",
    "result_txn_id": "a1-u02-txn-1",
    "state": "COMMITTED",
    "total_bytes": 25231,
    "verified_at": "2026-08-22T07:25:08Z"
  },
  "task_id": "a1-u02"
}
