{"acceptance_contract_sha256":"99281cd1457d679315998adf8a003bc5b27392cc4466e82347296f3c0289849f","artifacts":[{"artifact_id":"po03-wa-b2e7-042-lost-callback-replay-artifact-001","bytes":4149,"content_uri":"git:d95a010f64b271ed439da7250ae6719c17f02555:workstreams/po03/attempts/po03-wa-b2e7-042-lost-callback-replay/defect-record.json","logical_name":"defect-record.json","media_type":"application/json","readback_verified_at":"2026-08-22T07:21:08Z","sha256":"2756ded766a41f99687027f15a19803c0a7f184f7cac22e2e68721201a95104d"},{"artifact_id":"po03-wa-b2e7-042-lost-callback-replay-artifact-002","bytes":5917,"content_uri":"git:d95a010f64b271ed439da7250ae6719c17f02555:workstreams/po03/attempts/po03-wa-b2e7-042-lost-callback-replay/fault_kit.py","logical_name":"fault_kit.py","media_type":"text/x-python","readback_verified_at":"2026-08-22T07:21:08Z","sha256":"0ea4ca9f89bb7b2086e2c46aa7d853b6f97f34d5e12bf704ee342753900851ae"},{"artifact_id":"po03-wa-b2e7-042-lost-callback-replay-artifact-003","bytes":1334,"content_uri":"git:d95a010f64b271ed439da7250ae6719c17f02555:workstreams/po03/attempts/po03-wa-b2e7-042-lost-callback-replay/injection-report.json","logical_name":"injection-report.json","media_type":"application/json","readback_verified_at":"2026-08-22T07:21:08Z","sha256":"aa5331c3527693e548a5dfe1e8724b28057fb5956e609b6306f1227f9dbc5c40"},{"artifact_id":"po03-wa-b2e7-042-lost-callback-replay-artifact-004","bytes":5993,"content_uri":"git:d95a010f64b271ed439da7250ae6719c17f02555:workstreams/po03/attempts/po03-wa-b2e7-042-lost-callback-replay/lost_callback_injector.py","logical_name":"lost_callback_injector.py","media_type":"text/x-python","readback_verified_at":"2026-08-22T07:21:08Z","sha256":"4a47d2b7174b07a381db17aa10933f52dca5d25764954c6e9d381d3f6bc133bc"},{"artifact_id":"po03-wa-b2e7-042-lost-callback-replay-artifact-005","bytes":4266,"content_uri":"git:d95a010f64b271ed439da7250ae6719c17f02555:workstreams/po03/attempts/po03-wa-b2e7-042-lost-callback-replay/repair_candidate_replay_scan.py","logical_name":"repair_candidate_replay_scan.py","media_type":"text/x-python","readback_verified_at":"2026-08-22T07:21:08Z","sha256":"443a6acee73e0252cd2220078556b9771e8ac88f7cbae22c5889444b37c7f4b2"},{"artifact_id":"po03-wa-b2e7-042-lost-callback-replay-artifact-006","bytes":2367,"content_uri":"git:d95a010f64b271ed439da7250ae6719c17f02555:workstreams/po03/attempts/po03-wa-b2e7-042-lost-callback-replay/test-output.txt","logical_name":"test-output.txt","media_type":"text/plain","readback_verified_at":"2026-08-22T07:21:08Z","sha256":"6dcaa5ef111f8af08db36b9c9fe81949c144fdbba8f4991c9d1455d9eacea0cb"},{"artifact_id":"po03-wa-b2e7-042-lost-callback-replay-artifact-007","bytes":6951,"content_uri":"git:d95a010f64b271ed439da7250ae6719c17f02555:workstreams/po03/attempts/po03-wa-b2e7-042-lost-callback-replay/test_lost_callback_replay.py","logical_name":"test_lost_callback_replay.py","media_type":"text/x-python","readback_verified_at":"2026-08-22T07:21:08Z","sha256":"baf6fbce503ebf116842aebae3d2e3fe5fa9380fe9163857bdb8515dd25e5643"}],"attempt":{"attempt_id":"po03-wa-b2e7-042-lost-callback-replay-attempt-1","checkpoint_seq":1,"fence_token":42,"heartbeat_at":"2026-08-22T07:21:08Z","idempotency_key":"COM-PO03-REPOSITORY-ENGINEERING-PORTABLE-RUNTIME-20260822-v001:po03-wa-b2e7-042-lost-callback-replay:attempt-1","lease_id":"lease-po03-wa-b2e7-042-lost-callback-replay-1","provider_run_id":"NOT_SUPPORTED","worker_id":"po03-wa-b2e7-042-lost-callback-replay-producer"},"commission_id":"COM-PO03-REPOSITORY-ENGINEERING-PORTABLE-RUNTIME-20260822-v001","completion_actor":"coordinator","immutable_input_manifest_sha256":"02ed6f1b2719ab218d1be9a6f86543a7b52966a22dd9256dd610a30ab41b6289","independent_acceptance":{"receipt_uri":null,"reviewer_id":null,"state":"PENDING"},"obzio_state":"COMPLETED","protocol_version":"OBZIO-TRANSACTIONAL-RESULT-v1","provider_state":"RUNNING","result_transaction":{"artifact_count":7,"committed_at":"2026-08-22T07:21:08Z","manifest_sha256":"dfbc0f694cadf65252c4ed4b2f257ffd8baefc735e4333edb74d4d327b22298e","manifest_uri":"git:refs/heads/po03/wa-b2e7-c6:workstreams/po03/attempts/po03-wa-b2e7-042-lost-callback-replay/manifest.json","parent_ingested_at":"2026-08-22T07:27:57Z","result_commit_id":"d95a010f64b271ed439da7250ae6719c17f02555","result_txn_id":"result-po03-wa-b2e7-042-lost-callback-replay-1","state":"COMMITTED","total_bytes":30977,"verified_at":"2026-08-22T07:21:08Z"},"task_id":"po03-wa-b2e7-042-lost-callback-replay"}
