{
  "acceptance_contract_sha256": "aeb690fe666cc022fde7b7508541347337818ef735482294e73bc5b85e7ac524",
  "artifacts": [
    {
      "artifact_id": "a5-u01-art-01",
      "bytes": 3512,
      "content_uri": "git:cursor/po03-a5-research-conversion-ed20@c5e1c8143a3db3799aebee177f16c92e64958936:workstreams/po03/research/lib/counterfactual_engine.py",
      "logical_name": "counterfactual_engine.py",
      "media_type": "text/x-python",
      "readback_verified_at": "2026-08-22T07:27:09Z",
      "sha256": "ced41be4bf12071c834fad2d05a8cc2157579665d4967c00fc98f0844544a491"
    },
    {
      "artifact_id": "a5-u01-art-02",
      "bytes": 3027,
      "content_uri": "git:cursor/po03-a5-research-conversion-ed20@c5e1c8143a3db3799aebee177f16c92e64958936:workstreams/po03/research/lib/fault_matrix_u01.py",
      "logical_name": "fault_matrix_u01.py",
      "media_type": "text/x-python",
      "readback_verified_at": "2026-08-22T07:27:09Z",
      "sha256": "08e6765781c8098171256dde441d577d3f694cda00ebd983fce85e6ebd802502"
    },
    {
      "artifact_id": "a5-u01-art-03",
      "bytes": 2311,
      "content_uri": "git:cursor/po03-a5-research-conversion-ed20@c5e1c8143a3db3799aebee177f16c92e64958936:workstreams/po03/research/lib/sandboxed_control_plane.py",
      "logical_name": "sandboxed_control_plane.py",
      "media_type": "text/x-python",
      "readback_verified_at": "2026-08-22T07:27:09Z",
      "sha256": "b141431f7b928661a31ff6c121ebd7c1efe76c4d13830ea7143b9730743b6e85"
    },
    {
      "artifact_id": "a5-u01-art-04",
      "bytes": 3069,
      "content_uri": "git:cursor/po03-a5-research-conversion-ed20@c5e1c8143a3db3799aebee177f16c92e64958936:workstreams/po03/research/output/a5-u01-result.json",
      "logical_name": "a5-u01-result.json",
      "media_type": "application/json",
      "readback_verified_at": "2026-08-22T07:27:09Z",
      "sha256": "82e3cb6763bdc96eaa8753bc5568dc6800e9924e3e3b502b370d370a3ce1563a"
    },
    {
      "artifact_id": "a5-u01-art-05",
      "bytes": 10167,
      "content_uri": "git:cursor/po03-a5-research-conversion-ed20@c5e1c8143a3db3799aebee177f16c92e64958936:workstreams/po03/research/repro/run_u01_invariant_matrix.py",
      "logical_name": "run_u01_invariant_matrix.py",
      "media_type": "text/x-python",
      "readback_verified_at": "2026-08-22T07:27:09Z",
      "sha256": "969d90476f73fc350825ec48f28fff153c45fb78b4d4466691334e4e6db6f605"
    },
    {
      "artifact_id": "a5-u01-art-06",
      "bytes": 6009,
      "content_uri": "git:cursor/po03-a5-research-conversion-ed20@c5e1c8143a3db3799aebee177f16c92e64958936:workstreams/po03/tests/test_a5_fault_matrix_u01.py",
      "logical_name": "test_a5_fault_matrix_u01.py",
      "media_type": "text/x-python",
      "readback_verified_at": "2026-08-22T07:27:09Z",
      "sha256": "27aa18a3cf5c276d7929c4b7d8228e333ce56506f9874801bb08cd2476a81978"
    },
    {
      "artifact_id": "a5-u01-art-07",
      "bytes": 3908,
      "content_uri": "git:cursor/po03-a5-research-conversion-ed20@c5e1c8143a3db3799aebee177f16c92e64958936:workstreams/po03/tests/test_a5_sandboxed_control_plane.py",
      "logical_name": "test_a5_sandboxed_control_plane.py",
      "media_type": "text/x-python",
      "readback_verified_at": "2026-08-22T07:27:09Z",
      "sha256": "fb40798a24b56f10827c4b3b3261e393153469e493ffd950eb124463e2369f3d"
    }
  ],
  "attempt": {
    "attempt_id": "a5-u01-attempt-1",
    "checkpoint_seq": 7,
    "fence_token": 1,
    "heartbeat_at": "2026-08-22T07:27:09Z",
    "idempotency_key": "a5-u01:bb37bd312afab391",
    "lease_id": "lease-a5-u01-1",
    "provider_run_id": "po03-a5-subagent",
    "worker_id": "po03-worker-a5"
  },
  "commission_id": "COM-PO03-REPOSITORY-ENGINEERING-PORTABLE-RUNTIME-20260822-v001",
  "completion_actor": null,
  "immutable_input_manifest_sha256": "bb37bd312afab39135c141733b0f45c30198213f7ce48d2dec76582823e4b915",
  "independent_acceptance": {
    "receipt_uri": null,
    "reviewer_id": null,
    "state": "NOT_TESTED"
  },
  "obzio_state": "RESULT_COMMITTED",
  "protocol_version": "OBZIO-TRANSACTIONAL-RESULT-v1",
  "provider_state": "COMPLETED",
  "result_transaction": {
    "artifact_count": 7,
    "committed_at": "2026-08-22T07:27:09Z",
    "manifest_sha256": "0a7d1815b0b7617e503fb579f1dd65837fb99180e42e6964939bb45a4e7b656b",
    "manifest_uri": "git:cursor/po03-a5-research-conversion-ed20@c5e1c8143a3db3799aebee177f16c92e64958936:a5-u01",
    "parent_ingested_at": null,
    "result_commit_id": "c5e1c8143a3db3799aebee177f16c92e64958936",
    "result_txn_id": "a5-u01-txn-1",
    "state": "COMMITTED",
    "total_bytes": 32003,
    "verified_at": "2026-08-22T07:27:09Z"
  },
  "task_id": "a5-u01"
}
