{
  "acceptance_contract_sha256": "9ab9a0248e3bcc6f754023c8166f7adf43e96758baf228a4c5e66d98965ead15",
  "artifacts": [
    {
      "artifact_id": "PO03-WA-027:side_effect_free_loader.py",
      "bytes": 2814,
      "content_uri": "workstreams/po03/runs/wave-a/route-04/PO03-WA-027/side_effect_free_loader.py",
      "logical_name": "side_effect_free_loader.py",
      "media_type": "text/x-python",
      "readback_verified_at": null,
      "sha256": "ec8919850e375e564eadc8ecc4a96924aa0941fcdf4c1b29cc63510f1ec4e07e"
    },
    {
      "artifact_id": "PO03-WA-027:test_side_effect_free_loader.py",
      "bytes": 2540,
      "content_uri": "workstreams/po03/runs/wave-a/route-04/PO03-WA-027/test_side_effect_free_loader.py",
      "logical_name": "test_side_effect_free_loader.py",
      "media_type": "text/x-python",
      "readback_verified_at": null,
      "sha256": "5e53ae259b2a594817e4c9e115613a943ba23379b2ec640fcee53b3496040941"
    },
    {
      "artifact_id": "PO03-WA-027:observed-result.json",
      "bytes": 2579,
      "content_uri": "workstreams/po03/runs/wave-a/route-04/PO03-WA-027/observed-result.json",
      "logical_name": "observed-result.json",
      "media_type": "application/json",
      "readback_verified_at": null,
      "sha256": "b48783a75f5cbb816ad9ed672c84cb15bd4a0442e42113a4c249044aed9f8f39"
    },
    {
      "artifact_id": "PO03-WA-027:artifact-manifest.json",
      "bytes": 1836,
      "content_uri": "workstreams/po03/runs/wave-a/route-04/PO03-WA-027/artifact-manifest.json",
      "logical_name": "artifact-manifest.json",
      "media_type": "application/json",
      "readback_verified_at": null,
      "sha256": "d4fe2b0c6109512e194539421006b5fa75292509650d767a73bbe04172547e71"
    }
  ],
  "attempt": {
    "attempt_id": "PO03-WA-027-attempt-1",
    "checkpoint_seq": 2,
    "fence_token": 1,
    "heartbeat_at": null,
    "idempotency_key": "PO03-WAVE-A-20260822:PO03-WA-027:attempt-1",
    "lease_id": "lease-PO03-WA-027-1",
    "provider_run_id": "bc-aa38db59-c61c-4e29-9c26-4424b20f6e19",
    "worker_id": "task-agent:54509b12-231a-4f6f-9d33-6bc23ce2f788"
  },
  "commission_id": "COM-PO03-REPOSITORY-ENGINEERING-PORTABLE-RUNTIME-20260822-v001",
  "completion_actor": null,
  "immutable_input_manifest_sha256": "f66ba25343ceb8ce7810a7b241dd80b042b3b888ba498dcd61e48a29863c2f66",
  "independent_acceptance": {
    "receipt_uri": null,
    "reviewer_id": null,
    "state": "NOT_TESTED"
  },
  "obzio_state": "RESULT_STAGED",
  "protocol_version": "OBZIO-TRANSACTIONAL-RESULT-v1",
  "provider_state": "RUNNING",
  "result_transaction": {
    "artifact_count": 4,
    "committed_at": null,
    "manifest_sha256": "d4fe2b0c6109512e194539421006b5fa75292509650d767a73bbe04172547e71",
    "manifest_uri": "workstreams/po03/runs/wave-a/route-04/PO03-WA-027/artifact-manifest.json",
    "parent_ingested_at": null,
    "result_commit_id": null,
    "result_txn_id": "rtxn-PO03-WA-027-attempt-1",
    "state": "STAGED",
    "total_bytes": 9769,
    "verified_at": null
  },
  "task_id": "PO03-WA-027"
}
