{
  "acceptance_contract_sha256": "40fb0010c0e49f8cf2d05d3afe0cb5f87099a6d10d026c5e47d81387d0b8082e",
  "artifacts": [
    {
      "artifact_id": "PO03-WA-055:FINDING.md",
      "bytes": 3116,
      "content_uri": "po03/runs/wave-a/route-07/PO03-WA-055/FINDING.md",
      "logical_name": "FINDING.md",
      "media_type": "text/markdown",
      "readback_verified_at": "2026-08-22T08:04:17Z",
      "sha256": "9d0af3ce01d2c692212b1ff375cbfc9b330cfa0908622989ffbf620498ffb987"
    },
    {
      "artifact_id": "PO03-WA-055:candidate_ranker.py",
      "bytes": 7207,
      "content_uri": "po03/runs/wave-a/route-07/PO03-WA-055/candidate_ranker.py",
      "logical_name": "candidate_ranker.py",
      "media_type": "text/x-python",
      "readback_verified_at": "2026-08-22T08:04:17Z",
      "sha256": "1dd45e142eaed3a9c1c3d75a04d432ad7cf56e442002af866ef759b538f7a6c1"
    },
    {
      "artifact_id": "PO03-WA-055:evidence/observed-output.txt",
      "bytes": 3427,
      "content_uri": "po03/runs/wave-a/route-07/PO03-WA-055/evidence/observed-output.txt",
      "logical_name": "evidence/observed-output.txt",
      "media_type": "text/plain",
      "readback_verified_at": "2026-08-22T08:04:17Z",
      "sha256": "cc1443dc4d3818d6fe818416488ccf69cc3a51586f79833439919fdfb688c688"
    },
    {
      "artifact_id": "PO03-WA-055:test_candidate_ranker.py",
      "bytes": 8607,
      "content_uri": "po03/runs/wave-a/route-07/PO03-WA-055/test_candidate_ranker.py",
      "logical_name": "test_candidate_ranker.py",
      "media_type": "text/x-python",
      "readback_verified_at": "2026-08-22T08:04:17Z",
      "sha256": "149a2d05422fe69ad0b7121e4138ffb6e4e7aff61ffac4daf1d2a26aa3190f1b"
    }
  ],
  "attempt": {
    "attempt_id": "PO03-WA-055-attempt-1",
    "checkpoint_seq": 3,
    "fence_token": 1,
    "heartbeat_at": "2026-08-22T08:04:17Z",
    "idempotency_key": "PO03-WAVE-A-20260822:PO03-WA-055:attempt-1",
    "lease_id": "lease-PO03-WA-055-1",
    "provider_run_id": "bc-aa38db59-c61c-4e29-9c26-4424b20f6e19",
    "worker_id": "route-07-material-worker"
  },
  "commission_id": "COM-PO03-REPOSITORY-ENGINEERING-PORTABLE-RUNTIME-20260822-v001",
  "completion_actor": null,
  "immutable_input_manifest_sha256": "f66ba25343ceb8ce7810a7b241dd80b042b3b888ba498dcd61e48a29863c2f66",
  "independent_acceptance": {
    "receipt_uri": null,
    "reviewer_id": null,
    "state": "NOT_TESTED"
  },
  "obzio_state": "RESULT_STAGED",
  "protocol_version": "OBZIO-TRANSACTIONAL-RESULT-v1",
  "provider_state": "RUNNING",
  "result_transaction": {
    "artifact_count": 4,
    "committed_at": null,
    "manifest_sha256": "ed12e4dc32670808596c10331be91d3efaa0767faa94e8d39533488eb5e52ab3",
    "manifest_uri": "po03/runs/wave-a/route-07/PO03-WA-055/manifest.json",
    "parent_ingested_at": null,
    "result_commit_id": null,
    "result_txn_id": "PO03-WA-055-txn-1",
    "state": "STAGED",
    "total_bytes": 22357,
    "verified_at": "2026-08-22T08:04:17Z"
  },
  "task_id": "PO03-WA-055"
}
