{"acceptance_contract_sha256":"8ab781d39d20d98276facd22fa381290fe7fbe2db9db46282e8bfa0ca0d0165b","artifacts":[],"attempt":{"attempt_id":"po03-wa-b2e7-029-hash-coverage-completeness-attempt-1","checkpoint_seq":0,"fence_token":29,"heartbeat_at":null,"idempotency_key":"COM-PO03-REPOSITORY-ENGINEERING-PORTABLE-RUNTIME-20260822-v001:po03-wa-b2e7-029-hash-coverage-completeness:attempt-1","lease_id":"lease-po03-wa-b2e7-029-hash-coverage-completeness-1","provider_run_id":"PENDING_PROVIDER_ASSIGNMENT","worker_id":"PENDING_WORKER_ASSIGNMENT"},"commission_id":"COM-PO03-REPOSITORY-ENGINEERING-PORTABLE-RUNTIME-20260822-v001","completion_actor":null,"immutable_input_manifest_sha256":"a7a61ded77bbfa0fba6a8f61f0acbe7546fa50ad6ac64386d9c5d1edfd148f66","independent_acceptance":{"receipt_uri":null,"reviewer_id":null,"state":"NOT_TESTED"},"obzio_state":"CREATED","protocol_version":"OBZIO-TRANSACTIONAL-RESULT-v1","provider_state":"QUEUED","result_transaction":{"artifact_count":0,"committed_at":null,"manifest_sha256":null,"manifest_uri":null,"parent_ingested_at":null,"result_commit_id":null,"result_txn_id":"result-po03-wa-b2e7-029-hash-coverage-completeness-1","state":"RESERVED","total_bytes":0,"verified_at":null},"task_id":"po03-wa-b2e7-029-hash-coverage-completeness"}
