{"acceptance_contract_sha256":"9811753be2d9f8cbc75cb80a7856f28cd90d1f044dec3c3aa7baf4625f723693","artifacts":[],"attempt":{"attempt_id":"wave-a-016-result-schema-challenge-attempt-1","checkpoint_seq":0,"fence_token":1,"heartbeat_at":null,"idempotency_key":"COM-PO03-REPOSITORY-ENGINEERING-PORTABLE-RUNTIME-20260822-v001:wave-a-016-result-schema-challenge:attempt-1","lease_id":"lease-wave-a-016-result-schema-challenge-1","provider_run_id":"PENDING_PROVIDER_ASSIGNMENT","worker_id":"PENDING_WORKER_ASSIGNMENT"},"commission_id":"COM-PO03-REPOSITORY-ENGINEERING-PORTABLE-RUNTIME-20260822-v001","completion_actor":null,"immutable_input_manifest_sha256":"6032869a8edbcbf4b5029d2de35222c5b770b9c72702d92442afa53eb8681b03","independent_acceptance":{"receipt_uri":null,"reviewer_id":null,"state":"NOT_TESTED"},"obzio_state":"CREATED","protocol_version":"OBZIO-TRANSACTIONAL-RESULT-v1","provider_state":"QUEUED","result_transaction":{"artifact_count":0,"committed_at":null,"manifest_sha256":null,"manifest_uri":null,"parent_ingested_at":null,"result_commit_id":null,"result_txn_id":"result-wave-a-016-result-schema-challenge-1","state":"RESERVED","total_bytes":0,"verified_at":null},"task_id":"wave-a-016-result-schema-challenge"}
